{"status":"failed","opening_message":"De Tafel blijkt populair: Ivo wil hem ondersteboven zetten, Nia wil hem op drie poten laten staan en Oren probeert hem rood te maken.","final_player_message":"Het samenvoegen van de veranderingen is mislukt; de laatst werkelijk gelezen Tafel was bruin, stond rechtop en had vier poten.","accepted_state":{"color":"brown","orientation":"upright","leg_count":4},"selected_source_ids":[]}